{
    "schemaVersion": "image-upload-production-gate-receipt/v3-post-start-polling",
    "receiptId": "10000000-0000-4000-8000-000000000001",
    "receiptPathSha256": "1111111111111111111111111111111111111111111111111111111111111111",
    "createdAt": "2026-07-21T00:10:00.000Z",
    "release": {
        "imageReference": "ndt-studio-backend:bbbbbbbbbbbb",
        "imageDigest": "sha256:aaaaaaaaaaaaaaaaaaaaaaaaaaaaaaaaaaaaaaaaaaaaaaaaaaaaaaaaaaaaaaaa",
        "imageCommitSha": "bbbbbbbbbbbbbbbbbbbbbbbbbbbbbbbbbbbbbbbb",
        "commitSha": "bbbbbbbbbbbbbbbbbbbbbbbbbbbbbbbbbbbbbbbb",
        "releaseFingerprint": "sha256:e26d2da3ab585c9840b157a4a9b5639fda905c2ad33d04d2c598be8883b51236",
        "migrationChecksumSha256": "cccccccccccccccccccccccccccccccccccccccccccccccccccccccccccccccc"
    },
    "backups": {
        "preMigration": {
            "receiptPathSha256": "1212121212121212121212121212121212121212121212121212121212121212",
            "receiptSha256": "1313131313131313131313131313131313131313131313131313131313131313",
            "approvalPathSha256": "1414141414141414141414141414141414141414141414141414141414141414",
            "approvalSha256": "1515151515151515151515151515151515151515151515151515151515151515",
            "ciphertextSha256": "1616161616161616161616161616161616161616161616161616161616161616",
            "restoreVerifiedAt": "2026-07-20T23:30:00.000Z"
        },
        "postBridge": {
            "receiptPathSha256": "1717171717171717171717171717171717171717171717171717171717171717",
            "receiptSha256": "1818181818181818181818181818181818181818181818181818181818181818",
            "approvalPathSha256": "1919191919191919191919191919191919191919191919191919191919191919",
            "approvalSha256": "2020202020202020202020202020202020202020202020202020202020202020",
            "ciphertextSha256": "2121212121212121212121212121212121212121212121212121212121212121",
            "restoreVerifiedAt": "2026-07-21T00:05:00.000Z"
        }
    },
    "roles": {
        "apiFingerprintSha256": "2222222222222222222222222222222222222222222222222222222222222222",
        "reconcilerFingerprintSha256": "2323232323232323232323232323232323232323232323232323232323232323",
        "cutoverFingerprintSha256": "2424242424242424242424242424242424242424242424242424242424242424",
        "apiImageDigest": "sha256:aaaaaaaaaaaaaaaaaaaaaaaaaaaaaaaaaaaaaaaaaaaaaaaaaaaaaaaaaaaaaaaa",
        "migrationImageDigest": "sha256:aaaaaaaaaaaaaaaaaaaaaaaaaaaaaaaaaaaaaaaaaaaaaaaaaaaaaaaaaaaaaaaa",
        "reconcilerImageDigest": "sha256:aaaaaaaaaaaaaaaaaaaaaaaaaaaaaaaaaaaaaaaaaaaaaaaaaaaaaaaaaaaaaaaa",
        "reconcilerEnvironmentBuildFingerprint": "sha256:e26d2da3ab585c9840b157a4a9b5639fda905c2ad33d04d2c598be8883b51236",
        "heartbeatBuildFingerprint": "sha256:e26d2da3ab585c9840b157a4a9b5639fda905c2ad33d04d2c598be8883b51236",
        "readyApiProcesses": 1,
        "configuredApiProcesses": 1,
        "permitsPerProcess": 2,
        "advisoryLockOwnerCount": 1,
        "heartbeatAt": "2026-07-21T00:09:30.000Z",
        "pendingSessionExpiryCompletedAt": "2026-07-21T00:09:20.000Z",
        "promotionRecoveryCompletedAt": "2026-07-21T00:09:21.000Z",
        "temporaryCleanupCompletedAt": "2026-07-21T00:09:22.000Z",
        "imageDeletionCompletedAt": "2026-07-21T00:09:23.000Z",
        "rateLimitCleanupCompletedAt": "2026-07-21T00:09:24.000Z"
    },
    "provider": {
        "accountIdSha256": "2525252525252525252525252525252525252525252525252525252525252525",
        "bucketNameSha256": "2626262626262626262626262626262626262626262626262626262626262626",
        "endpointSha256": "2727272727272727272727272727272727272727272727272727272727272727",
        "apiR2CredentialFingerprintSha256": "2828282828282828282828282828282828282828282828282828282828282828",
        "reconcilerR2CredentialFingerprintSha256": "2929292929292929292929292929292929292929292929292929292929292929",
        "cutoverR2CredentialFingerprintSha256": "3030303030303030303030303030303030303030303030303030303030303030",
        "cutoverR2ConfigReadCredentialFingerprintSha256": "4141414141414141414141414141414141414141414141414141414141414141",
        "imgproxyCredentialFingerprintSha256": "3131313131313131313131313131313131313131313131313131313131313131",
        "providerReadbackSha256": "3232323232323232323232323232323232323232323232323232323232323232",
        "corsReadbackSha256": "3333333333333333333333333333333333333333333333333333333333333333",
        "reconcileGraceMs": 30000,
        "reconcileCadenceMs": 5000
    },
    "cutover": {
        "auditReceiptPathSha256": "3434343434343434343434343434343434343434343434343434343434343434",
        "auditReceiptSha256": "3535353535353535353535353535353535353535353535353535353535353535",
        "dispositionPathSha256": [],
        "dispositionSha256": [],
        "backupBindingMismatchCount": 0,
        "dispositionInvalidCount": 0
    },
    "preDeployPollingSnapshotSha256": [
        "4242424242424242424242424242424242424242424242424242424242424242",
        "4343434343434343434343434343434343434343434343434343434343434343"
    ],
    "pollingSnapshots": [
        {
            "observedAt": "2026-07-21T00:09:00.000Z",
            "activeUploads": 0,
            "unterminalizedExpiredUploads": 0,
            "unresolvedPromotions": 0,
            "invalidResponseHeadSettlement": 0,
            "invalidPromotionAuthority": 0,
            "invalidCleanupAuthority": 0,
            "invalidPromotionConflictEvidence": 0,
            "openPromotionConflicts": 0,
            "dueTemporaryCleanup": 0,
            "unverifiedTemporaryCleanup": 0,
            "unresolvedR2ImageDeletion": 0,
            "invalidR2DeletionAuthority": 0,
            "invalidNonR2DeletionDisposition": 0,
            "legacyTerminalTempPresent": 0,
            "legacyPreDispatchTempPresent": 0,
            "corsMismatch": 0
        },
        {
            "observedAt": "2026-07-21T00:09:30.000Z",
            "activeUploads": 0,
            "unterminalizedExpiredUploads": 0,
            "unresolvedPromotions": 0,
            "invalidResponseHeadSettlement": 0,
            "invalidPromotionAuthority": 0,
            "invalidCleanupAuthority": 0,
            "invalidPromotionConflictEvidence": 0,
            "openPromotionConflicts": 0,
            "dueTemporaryCleanup": 0,
            "unverifiedTemporaryCleanup": 0,
            "unresolvedR2ImageDeletion": 0,
            "invalidR2DeletionAuthority": 0,
            "invalidNonR2DeletionDisposition": 0,
            "legacyTerminalTempPresent": 0,
            "legacyPreDispatchTempPresent": 0,
            "corsMismatch": 0
        }
    ],
    "ci": {
        "rulesetId": "1234567",
        "enforcement": "active",
        "bypassActorCount": 0,
        "contexts": [
            "backend-image-upload",
            "image-upload-packaging",
            "frontend-playwright-chromium"
        ]
    },
    "stagingReceiptPathSha256": "3939393939393939393939393939393939393939393939393939393939393939",
    "stagingReceiptSha256": "3636363636363636363636363636363636363636363636363636363636363636",
    "startupApprovalPathSha256": "4040404040404040404040404040404040404040404040404040404040404040",
    "startupApprovalSha256": "3737373737373737373737373737373737373737373737373737373737373737",
    "canonicalSha256": "ffffffffffffffffffffffffffffffffffffffffffffffffffffffffffffffff"
}
